{
  "categoryScores": {
    "artifactFree": 95,
    "compositionRoute": 95,
    "identityMatch": 95,
    "lightingReadability": 95,
    "materialPbr": 95,
    "moodArtDirection": 95,
    "silhouetteGeometry": 95,
    "textureDetail": 95
  },
  "firstVisibleFailure": "",
  "pass": true,
  "promotionStatus": "accept",
  "requiredChanges": [],
  "score": 95,
  "topSemanticDifferences": []
}
